Nombre,Correo Electronico,Numero de Telefono,Fecha de la Reunion,Vendedor asignado,closed,Transcripcion
Diego Morales,d.morales@example.com,56911223344,2024-07-10,Toro,1,"Gracias por la reunion, aunque debo ser honesto, tengo muchas dudas sobre esta solucion. Nuestra empresa de servicios financieros ha estado evaluando opciones de automatizacion, pero me preocupa mucho la seguridad de los datos de nuestros clientes. No estoy seguro de que una solucion automatizada pueda manejar la complejidad de nuestras consultas financieras. Ademas, el costo que mencionaron me parece muy alto para lo que ofrecen. Sin embargo, tenemos una necesidad urgente porque nuestro equipo esta completamente sobrecargado con mas de 400 consultas semanales. Si bien tengo reservas, creo que podriamos probar con un piloto muy limitado, pero no estoy convencido de que esto vaya a funcionar realmente."
Sofia Herrera,s.herrera@example.com,56922334455,2024-07-15,Puma,1,"Durante la reunion exprese mis preocupaciones sobre implementar Vambe en nuestra clinica. Tengo serias dudas sobre si una herramienta automatizada puede entender el contexto medico y las sensibilidades que requiere nuestro sector. Me preocupa mucho la confidencialidad y el cumplimiento normativo. El proceso de integracion con nuestro sistema de citas suena complicado y costoso. Aunque reconozco que tenemos un problema real con aproximadamente 90 interacciones diarias que estan saturando a nuestro equipo, no estoy seguro de que esta sea la solucion correcta. Sin embargo, dado que no tenemos otras opciones viables en este momento y la presion es alta, estariamos dispuestos a avanzar, pero con muchas reservas y un periodo de prueba muy estricto."
Ricardo Mendez,r.mendez@example.com,56933445566,2024-07-20,Zorro,1,"La verdad es que tengo muchas dudas sobre Vambe. Nuestra startup tecnologica ha evaluado varias soluciones y esta no me convence del todo. Me preocupa que la personalizacion no sea suficiente para nuestras necesidades especificas y que la integracion con nuestras plataformas sea mas compleja de lo que dicen. El precio tambien es un factor importante para nosotros como empresa joven. Aunque tenemos un volumen creciente de interacciones que esta afectando nuestro equipo, no estoy seguro de que esta sea la mejor inversion. Sin embargo, dado que necesitamos una solucion rapida y no hemos encontrado alternativas mejores, podriamos considerar un acuerdo, pero con muchas condiciones y expectativas bajas sobre los resultados."
Patricia Castro,p.castro@example.com,56944556677,2024-07-25,Boa,0,"Despues de la reunion, debo decir que tengo serias reservas sobre Vambe. Nuestra empresa de logistica necesita una solucion para manejar las aproximadamente 180 consultas diarias durante picos de demanda, pero no estoy convencida de que esta herramienta pueda cumplir con nuestras expectativas. Me preocupa especialmente la capacidad de manejar actualizaciones en tiempo real de envios de manera confiable. Ademas, el costo de implementacion y mantenimiento es significativo para nuestro presupuesto. He evaluado otras opciones y creo que necesitamos mas tiempo para tomar una decision. Por ahora, prefiero no avanzar con esta solucion ya que no estoy segura de que realmente resuelva nuestros problemas de manera efectiva."
Andres Jimenez,a.jimenez@example.com,56955667788,2024-07-30,Tiburón,0,"Tengo que ser directo: no estoy convencido de que Vambe sea la solucion adecuada para nuestra agencia de viajes. Aunque mencionaron que pueden ofrecer recomendaciones personalizadas, tengo dudas sobre si realmente pueden entender la complejidad de nuestros servicios y las necesidades especificas de cada cliente. El volumen de interacciones que manejamos, alrededor de 250 semanales, es un problema real, pero no creo que automatizar completamente sea la respuesta. Me preocupa perder el toque personal que es fundamental en nuestro negocio. Ademas, el proceso de implementacion parece complicado y el retorno de inversion no esta claro para mi. Por estas razones, he decidido no continuar con esta propuesta en este momento."
